<!--
Copyright 2016 Goldman Sachs.
Licensed under the Apache License, Version 2.0 (the "License");
you may not use this file except in compliance with the License.
You may obtain a copy of the License at

  http://www.apache.org/licenses/LICENSE-2.0

Unless required by applicable law or agreed to in writing,
software distributed under the License is distributed on an
"AS IS" BASIS, WITHOUT WARRANTIES OR CONDITIONS OF ANY
KIND, either express or implied.  See the License for the
specific language governing permissions and limitations
under the License.
-->
<application implementation="com.gs.fw.para.application.wabofewabuzaqeyagelac.persistence.SutoCerakematokuroBedesiyajax"
             ignoreLoadFailures="true"
             name="SutoCerakematokuroBedesiyajax"
             xmlns:xsi="http://www.w3.org/2001/XMLSchema-instance"
             xsi:noNamespaceSchemaLocation="../../../xsd/configuration.xsd">

    <services>

        <service-instance id="dayoyuniJemuwus" implementation="DulugeVopigaguQalihor" type="DayoyuniJemuwus"/>

        <embedded-instance id="mithra" interface="com.gs.fw.para.service.mithra.FigotoLufikum"
                           implementation="com.gs.fw.para.service.mithra.implementation.RorudiXucilewAvih">
            <properties>
                <scalar name="nopiwosopebAniyeco" invokeSetter="true">600</scalar>
                <list name="pehijeWakufihanocijAcax" invokeSetter="true">
                    <value>services/Mithra/RigiDaseyezafUsowUfacumAvabihUrapodizolige.xml</value>
                    <value>services/Mithra/CiwaZamumeBuwOtafUwafoqElosuwunuzaqe.xml</value>
                    <value>services/Mithra/LelikikElupUjevuhuxabecegAqufuvOfusetehivuqi.xml</value>
                </list>
            </properties>
        </embedded-instance>


        <embedded-instance id="sajiyanEDUVOyaxIlupigazifa"
                           interface="com.gs.fw.para.application.wabofewabuzaqeyagelac.persistence.YibehisOZIsuyagOyikasoco"
                           implementation="com.gs.fw.para.application.wabofewabuzaqeyagelac.persistence.QidawuvOKEqoqagEbayesatiZace">
            <services>
                <embedded-instance id="cixifEdusibUmageme"
                                   interface="com.gs.fw.para.application.wabofewabuzaqeyagelac.persistence.CixifEdusibUmageme"
                                   implementation="com.gs.fw.para.application.wabofewabuzaqeyagelac.persistence.implementation.XerISIFEvemAguwaxIrupepo"/>

                <embedded-instance id="tilicoye1"
                                   interface="com.gs.fw.para.application.wabofewabuzaqeyagelac.persistence.FexohErumafad"
                                   implementation="com.gs.fw.para.application.wabofewabuzaqeyagelac.persistence.implementation.BuhecesEzoduwOkuxoSefefaqa">
                    <services>
                        <embedded-instance id="soqoga"
                                           interface="com.gs.fw.para.application.wabofewabuzaqeyagelac.persistence.implementation.DuvuxefoxapujUqiZekotuhUtuqobOyehoTitoyixe"
                                           implementation="com.gs.fw.para.application.wabofewabuzaqeyagelac.persistence.implementation.MujupilASImukeferujeBahohudirolec"/>
                    </services>
                </embedded-instance>

                <embedded-instance id="tilicoye2"
                                   interface="com.gs.fw.para.application.wabofewabuzaqeyagelac.persistence.FexohErumafad"
                                   implementation="com.gs.fw.para.application.wabofewabuzaqeyagelac.persistence.implementation.LarokenoZufiGufogEtohefap">
                    <services>
                        <embedded-instance id="duyiQirafadubiceyuZipa"
                                           interface="com.gs.fw.para.application.wabofewabuzaqeyagelac.persistence.TenoLivovorolasifuMehibu"
                                           implementation="com.gs.fw.para.application.wabofewabuzaqeyagelac.persistence.RafifecIbusUduhizehiqowojUdemadOrok">
                            <services>

                                <embedded-instance id="kogovICotijaniwiduhuRado"
                                                   interface="com.gs.fw.para.application.wabofewabuzaqeyagelac.persistence.BizopOWihosebeqatuhoYomiqi"
                                                   implementation="com.gs.fw.para.application.wabofewabuzaqeyagelac.persistence.HefIjopUwuheBehunUBoducetawekodaCakoxiWeki">
                                    <properties>
                                        <scalar name="ceqeQic" invokeSetter="true">
                                            sofitowalagupi/bere/VojiyuloJovodopatopakoBoku.xml
                                        </scalar>
                                        <scalar name="wirigaBoqunadAteziviMohuge" invokeSetter="true">false</scalar>
                                        <scalar name="ruwenuM" invokeSetter="true">1001</scalar>
                                        <scalar name="pirAtuLe" invokeSetter="true">-30</scalar>
                                    </properties>

                                </embedded-instance>

                            </services>
                        </embedded-instance>
                    </services>
                </embedded-instance>

                <embedded-instance id="tilicoye3"
                                   interface="com.gs.fw.para.application.wabofewabuzaqeyagelac.persistence.FexohErumafad"
                                   implementation="com.gs.fw.para.application.wabofewabuzaqeyagelac.persistence.implementation.BuhecesEzoduwOkuxoSefefaqa">
                    <services>
                        <embedded-instance id="multi_xap_soqoga"
                                           interface="com.gs.fw.para.application.wabofewabuzaqeyagelac.persistence.implementation.DuvuxefoxapujUqiZekotuhUtuqobOyehoTitoyixe"
                                           implementation="com.gs.fw.para.application.wabofewabuzaqeyagelac.persistence.implementation.CopekAyiripUqinExehOdecijofoxaYozebatoxamov">
                            <services>
                                <embedded-instance id="putikAGebazub"
                                                   interface="com.gs.fw.para.application.wabofewabuzaqeyagelac.persistence.TodiziwewofehuKunijit"
                                                   implementation="com.gs.fw.para.application.wabofewabuzaqeyagelac.persistence.implementation.ZaxaqogejiveguZajoyiqUruz">
                                    <services>
                                        <embedded-instance id="kogovICotijaniwiduhuRado"
                                                           interface="com.gs.fw.para.application.wabofewabuzaqeyagelac.persistence.BizopOWihosebeqatuhoYomiqi"
                                                           implementation="com.gs.fw.para.application.wabofewabuzaqeyagelac.persistence.HefIjopUwuheBehunUBoducetawekodaCakoxiWeki">
                                            <properties>
                                                <scalar name="ceqeQic" invokeSetter="true">
                                                    sofitowalagupi/bere/MUKOqalilukejoqolEjod.xml
                                                </scalar>
                                                <scalar name="wirigaBoqunadAteziviMohuge" invokeSetter="true">true
                                                </scalar>
                                                <scalar name="ruwenuM" invokeSetter="true">1002</scalar>
                                                <scalar name="pirAtuLe" invokeSetter="true">-10</scalar>
                                            </properties>
                                        </embedded-instance>
                                    </services>
                                </embedded-instance>
                            </services>

                        </embedded-instance>

                    </services>
                </embedded-instance>

            </services>
        </embedded-instance>
    </services>


</application>
